Description,Category
Washington Correspondent New York Magazine Writing a book with for Simon Schusters Avid Reader about 2020 Olivia Nuzzi com,Non_Adult
Host of NPR s Pop Culture Happy Hour Author NYT Bestseller EVVIE DRAKE STARTS OVER IG lindaholmes97,Non_Adult
Gay Men Ring Free gay tube for mature gay men updated with gay porn videos and gay sex movies,Adult
SeeMomSuck is packed with the best Amateur Step Mom Blowjobs Download Hot x000D Mom and Teen Blowjob Videos at SeeMomSuck,Adult
xReview com provides in depth porn site reviews and offers discount codes and links of up to 75 off some of the top porn sites on the Internet,Adult
Author columnist doctor Hindustani music Newsletter SATTVA Everyday Superfoods March 2021,Non_Adult
Siterip Download Download Free Siterips and Videos from paysites oday daily update mydirtyhobby free download or watch online,Adult
FM DDL all downloads are 100 legal,Non_Adult
go to youtube and subscribe to this channel TASIN NEWS TV and TASIN NEWS TV2,Non_Adult
Diplomatic correspondent Senior Contributing Editor The Jerusalem Post podcast host ex Knesset reporter Proud Jew and Zionist Wears pink on Wednesdays,Non_Adult
Editorial Features Editor in charge of op ed pages Best of the Web columnist 2000 17 Pu,Non_Adult
The official Twitter account for Sky Sports News Your home of sports news on channel 409,Non_Adult
Trending Topics Femdom Clips Taboo Fetish Porn Ballon Cosplay Porn Sissy Porn Sissy hypno JOI CEI,Adult
Free porn videos with horny teens Teenage girls ready to fuck,Adult
News Anchor Founder of Specialize in breaking news,Non_Adult
Design thinker company advisor professor columnist author Latest book Design of Everyday Things Revised and Expanded,Non_Adult
Twitch Broadcaster Indie Game Dev Business Inquiries waffle tv,Non_Adult
CEO Chief Strategist Quill Intelligence LLC columnist Fmr Federal Reserve insider Author FedUp,Non_Adult
If you want to be a part of something bigger join PervCity Our streets are lined with big tits big ass and pussies wet for your big dick all day every day Our blonde brunette and redhead anal addicts always give the green light to drive fast and hard into their ass,Adult
Manchester football correspondent Guardian Observer Solskjr biographer Novelist agent POETRY Everyone knows how it ends Delphie Leonardo,Non_Adult
Real Live Hidden Cameras and Voyeur Videos,Adult
Check out the best Mature porn tube with tons of high quality xxx Mom videos of hot mature women Matures Grannies Moms and Boys Asian matures Mature shemales Mature dildo Mature lesbians,Adult
Actor Director Founder of GSF Author of NYT Bestseller Grateful American,Non_Adult
HypnoHub Serving 109 805 posts,Adult
Fleshlight Girls Get inside your favorite stars,Adult
Porno free daily updated stream online xxx videos selected by surfers that voted for best videos in Porno Chatik Tons of free porn sex movies especially for You on this site We have matures lesbies housewifes gays shemales they all fuck and suck each other in really hot videos located on PornoChatik com online We work very hard to choose and locate best free porn videos on Pornochatik com please come inside and enjoy best porn in Internet,Adult
The leading brand for LGBTQI women and non binary people Love women Love DIVA Published by Subscribe buy via the link below,Non_Adult
Ireland s premier breaking news website providing up to the minute news and sports reports With e mail news releases following breaking stories throughout the day,Non_Adult
Author Formerly director AFP news agency Jordan and Amnesty International regional director for MENA Committed to live fully every day until the expiry date,Non_Adult
Xtube com is no longer available Watch FREE hardcore porn videos The best Adult Community with both Straight and Gay Sex Movies full of hot 18 amateurs,Adult
Featuring sexy girls with muscle Free pictures and video of the hottest female bodybuilders fitness models athletes hard body porn stars and more,Adult
Senior Correspondent contributing writer Author of IN TRUMP S SHADOW via,Non_Adult
TV news station serving the Alabama and Florida Gulf Coast areas,Non_Adult
The OG youth culture platform in the UK Multi channel live and experiential agency for some of the UKs biggest youth focused brands,Non_Adult
National columnist for HockeyBuzz and Red Wings beat writer for Detroit Hockey Now Previously was USA TODAY s hockey writer for 34 seasons 1986 2019,Non_Adult
Dr Porn Tube offers amazing collection of free porn videos and hardcore movies We update daily,Adult
Gay London Guide LGBT Events Parties Cabaret QX Queer Gay London Life Nightlife listings UPDATED WEEKLY 2022,Non_Adult
Phoenix breaking news weather politics sports and more Tweet us your tips and pics with hashtag fox10phoenix,Non_Adult
Black singles know BlackPeopleMeet com is the premier online destination for African American dating To meet black men or black women in your area sign up today FREE Learn more here,Adult
Thank you for stopping by the place to go for exclusive local stories the latest breaking news weather updates and more,Non_Adult
Cyber Defense Magazine The Premier Source for IT Security and Compliance Information,Non_Adult
Watch 100 free porn videos on sextvx Find the newest full length movies to play only on sextvx com Sextvx com is a free hosting for porn videos Watch and download all Porn Videos at Sextvx for Free including HD Sextvx is the ultimate xxx porn sex and pussy tube download sex videos or stream free xxx and free sex movies,Adult
Download Porn video BDSM Femdom Anal Teen Shemale Gay Bukkake Fisting HotKinkyJo PremiumBukkake SpermMania Dickdrainers p p p tv Goddes and many more,Adult
Follow us for the latest KCON news and K pop clips original content more,Non_Adult
FREE Archives Parody Art and Sex Comics by JAB Exclusive never before seen original sex comics Farm Lessons The Wrong House Ay Papi and more,Adult
I teach journalism at NYU critique the press try to suggest reforms PressThink is the name of my subject and my site Started blogging in 2003 Still at it,Non_Adult
Free Jav HD Porn and download Jav HD Porn Videos Watch the free best uncensored JAPANESE porn videos in FULL HD free quality Download or stream authentic JAV with the sexiest Asian pornstars and Japans hottest AV idols Free JAV video Free download porn video Asian Adult Videos Japanese Porn online judge Asian video collection,Adult
GeekxGirls com featuring geeky cosplay fan art comics memes more Fansite for lovers of sci fi fantasy games anime comic books and all things geek,Non_Adult
Official Twitter account for The Hospital for Sick Children SickKids Our vision Healthier Children A Better World Account not monitored 24 7,Non_Adult
Welcome to my sex games site Here you will find the best free sex games for your pleasure I use to update often so don t forget to return soon Enjoy,Adult
Every day new and high quality gay porn videos on the Go GayTube Visit us and you will not have to pay money rate the video and enjoy watching video on a big player,Adult
Kabul correspondent Born in Kabul Raised in Little Kabul Declared independence in DC Back in Kabul Views my own but if you like em,Non_Adult
Hot moms teaching cute teens how to fuck deep throat and hardcore anal here at www momsteachingteens com,Adult
Partnered Facebook Broadcaster Contact rivaLxfactor com Xidax PC s,Non_Adult
covers breaking news and business stories in Dubai the UAE and the GCC,Non_Adult
Beautiful girls accommodating their male partners by offering all their orifices up to be pleasured Shot with the highest quality cameras and top video encoding settings this is anal sex like you ve never seen before,Adult
Member Broadcast VP Governing Board,Non_Adult
Human rights and peace worker writer columnist researcher and teacher works with survivors of mass violence hunger homeless persons and street children,Non_Adult
Social psychologist NYT bestseller TED talker Deadhead Roller skater Skier Mom Partner Next book Bullies Bystanders Bravehearts Mariner,Non_Adult
We bring you the best free porn from the best sites on the internet today We have all the content that you cannot find at other free sites,Adult
A bimonthly US magazine about wild birds birding Our December issue features 16 limited range non native songbirds the Harpy Eagle lens reviews and more,Non_Adult
EdTech issues facing K12 IT leaders admins and educators Sponsored by CDWG Sign up for timely insights free,Non_Adult
Javanan is the premiere Persian English publication outside of Iran Arts culture entertainment sports world news celebrating 30 years in print,Non_Adult
Top Porn Movies 2017 British Cock Sucking Contest Brazilian Teen Anal Porn Thai First Time Sex Czech Pornstar Movies Danish Porn Videos Russian Homemade Porn Dutch College Girls Sex and much more,Adult
Featuring 1 588 hairy pussy models with over 2 796 961 hairy photos and 5 000 videos ATK Hairy also offers daily exclusive updates with 8 High Res photo sets and 3 HD videos per update,Adult
enjoy large natural breasts and nude big tits babes,Adult
Sports News Correspondent Sports Agenda Editor mike keegan co uk,Non_Adult
Unify Personify Electrify Edify Magazine is on stands now,Non_Adult
Breaking news live updates and developing stories around the world Follow for in depth coverage features videos and more,Non_Adult
Chief Political Correspondent Sky News reporting politics at Westminster since Jan 1982 Asian Voice Journalist of the Year 2019,Non_Adult
Welcome to Gay Fuck Porn Tube We daily see new gay videos online for free viewing We collect for you only quality video clips,Adult
Ideas to help promote your business without the hype by Matthew Meyer Your comments are always welcome,Non_Adult
Exclusive family nudist images and video filmed daily from Europe and America,Adult
Sr Political Analyst Fox News Channel Arguments welcome Name callers verbal abusers blocked,Non_Adult
Blogaholic CornwallMake money online Healthy living Travel HomeClick for blogs free cashWork with me page,Non_Adult
The home of talkRADIO and talkRADIO TV talkTV is coming soon,Non_Adult
The top sports stories and insights from the global staff of The breaking news since 1846 Please also follow Top25 NFL and Deportes,Non_Adult
Cherry Blossoms is the best dating site to chat or meet Philippine and Asian women In business since 1974 Blossoms com has 100K visits monthly Featured in Seattle Daily Join for Free Now,Adult
Watch free porn videos at pornrox com with new clips added daily Find sexy pornstars on your desktop or mobile phone without worrying about annoying adds and streaming speeds that will make you flip the table We bring the porn tube experience to your door in a secure connection for free,Adult
Only Child Millennial Gemini Tommy Kelly Show RealFunDC SCENE Correspondent Live Event Host Scrappy Kid From Scranton,Non_Adult
Proud to have worked for China s national broadcaster for over two decades witnessed the rise of the Chinese people Views are my own,Non_Adult
Handpicked online streaming porn videos is what we have here for endless enjoyment We have all the tube porn videos you need in here,Adult
US China correspondent Financial TimesFormer Washington Bureau ChiefPentagon CIASouth ChinaAsia News EditorDubliner Signal 202 763 4267,Non_Adult
Daily newspaper serving since 1900 Check out our sections,Non_Adult
Extreme zoo porn videos and animal XXX clips from xVideos featuring scenes of zoophilia and bestiality sex exclusively on our free tube Shocking collection,Adult
Cultural Political Commentator E News Telemundo Clevver ESPN Deportes Cuban Lebanese Parts Miami Made BOOKINGS COM TEXT 305 363 1841,Non_Adult
Global finance correspondent for the Financial Times Semi professional Norwegian despite the Harry Potter esque name Author of Trillions Views mine bla bla,Non_Adult
Breaking News and Weather for Northwest Arkansas and the River Valley 4029News,Non_Adult
Presenter of Inside Health on and health and science correspondent Contrary to popular opinion my middle name is not Tiberius,Non_Adult
Bringing you the best in local and statewide news across Michigan,Non_Adult
Porn Mega Load Download the highest quality porn on the net Take your favorite teens BBWs MILFs amateurs big booty girls and big boob women with you anywhere,Adult
Breaking news weather entertainment information for Portland area NBC affiliate News tips newsdesk com or TEXT 503 226 5088 kgwnews kgw,Non_Adult
Amateur exgirlfriends nude sex pics SexNemo com ugly nextdoor porn,Adult
Breaking news updates from the website of Malaysia s free and largest circulating urban newspaper Like Thesundaily on Facebook Instagram,Non_Adult
Xxx videos Hd sex movies Palm Tube is great porn tube with big collection of 100 free porn Our addictive sex tube is also adapted for mobile devices,Adult
hairy sex hairy pussy hairy women hairy girls hairy cunt hairy bush hairy porn hairy vagina hairy erotica hairy pussies hairy pussy pics hairy nudes hairy pussy fucking,Adult
Your source of free porno videos Famous pornstars fresh HD videos from the best porn producers and homemade amateur stuff,Adult
Breaking Hong Kong News as it happens,Non_Adult
Mike Barnicle is an award winning print and broadcast journalist and a social and political commentator Watch Mike Barnicle at,Non_Adult
DarkX is your portal to hardcore interracial porn with tiny girls and huge black cocks Watch exclusive first time interracial sex with the hottest stars,Adult
For 30 years SpaceNews has set the authoritative standard for independent space journalism Subscribe to our newsletters,Non_Adult
Pinoy erotic gay story writer japanese porn stan underwear fetish TAKEN Be a patron Add me on FB,Adult
Reports from News political team,Non_Adult
Hand picked collection of adult films ready to be enjoyed for free thats what the porn tube at Porno Teen Sex offers you These XXX vids are awesome check them out,Adult
Socialist antifascist Guardian columnist author podcaster YouTuber geriatric millennial He him Subscribe to our YouTube channel,Non_Adult
The most informative half hour in Canada Weeknights with and weekends with Global For breaking news follow,Non_Adult
Free porn Japanese Mom Casting Stepmom Teen Anal Wife Hairy Lesbian Mature Japanese Uncensored Teen Chinese Webcam Granny Solo and much more,Adult
Welcome to our Free Porn Movs tube site Check out featured porno clips on Newpornmovs com,Adult
Tech journalist since 2007 Bylines former editor at Digital Trends,Non_Adult
All Free Porn Videos Celebs Vintage Classic Porn Pornstars Models Kinky Fetish BDSM Gay Ethnic Gay Bi Sexual Shemale Ladyboy Hentai Anime Amateur Softcore Hardcore Men,Adult
Hidden cameras the real massage salon real Czech amateurs oral sex anal voyeur mature women 18 years old,Adult
Come to the best site for cheaters Score a hot hookup with someone who only wants you for one thing Don t wait Join today,Adult
Legal Young girl movies at Give Me Young Dot Com Best movies only,Adult
Award winning broadcaster journalist author voice artist Official Account YouTube Rep d by bgorman com,Non_Adult
Entrepreneur Investor Author Marketing Expert Columnist on and other major publications,Non_Adult
Official Neuroscience News Twitter Brain research news articles on neuroscience psychology AI neurology brain cancer robotics mental health science,Non_Adult
White House Correspondent alum monica alba com,Non_Adult
FCA Director Cardinals Broadcaster Views are my own and don t represent the views of FCA or the Cardinals Follow me on instagram,Non_Adult
Get latest Bollywood news celebrity news new hindi movie releases,Non_Adult
Journalist Broadcaster Author of Hidden Heritage OUT IN BOOKSHOPS NOW or order here photo Sophie Davidson,Non_Adult
All the news and information you need to see curated by the News team Watch full ABC News broadcasts on,Non_Adult
Ebony Naked Girls african naked girls black boobs private pictures naked teen girls black pussy ebony amateur ebony women and young ebony girls is naked in free homemade and self shot pictures,Adult
Welcome to PremiumHDV a site devoted to beautiful babes captured as they should be in High Definition The site offers a lucrative collection of,Adult
Cock horse porn for free Ride on animal cock stretching pussy by horse playing with bull balls real bestiality porn in woods,Adult
Free Zoo Porn Bistiality Movies Animal Videos from XNXX Xvideos Xhamster Pornhub Tube8 and another XXX Tube Sites Horses dogs and more,Adult
Big collection of free porn videos DinoTube the 1 XXX site Over 10 million free porn videos watch em now,Adult
The official page of Sudan News Agency SUNA Sudan,Non_Adult
is your one stop source for Dune news and reviews incl DuneMovie 2021 books comics games and future TV shows Home of,Non_Adult
Breaking news analysis and commentary on all things conservation,Non_Adult
Come and Check Out Our Enormous Collection of Freshest Porn Videos and Sex Movies on vivatube com,Adult
Teen Sex Hot tube has large collection of horny and nasty teen girls videos In porno clips these passionate young bitches posing naked expose their bodies show perky tits and round asses fucking and sucking cocks,Adult
Free real tube movies real teen amateur homemade mature movies categorical tube archive updated daily real movies,Adult
The next generation of entertainment news,Non_Adult
Breaking news and updates from Africa s 1 independent media brand WeAreNation,Non_Adult
First book out Jan 25 Columnist Senior Fellow Speaker wajahatmali com,Non_Adult
The Spirit of Competition All Motorsport News Team com,Non_Adult
4pig com is Free Porn Tube Only Hot as Hell HD Amateur Porn Videos Sex Clips Available on all mobile devices iPhone iPad or Android For FREE,Adult
Welcome to the section of porno and erotica namely the photo collection of naked girls Over 50 million porn pics available for free,Adult
Private is the best source for adult movies and videos Featuring the most popular hardcore adult stars in hundreds of porn movies Private com delivers,Adult
Looking for a casual matchmaking site that will bring your closer to your perfect date Why not try xTonight and see what we ve got in store for you Sign up now xTonight,Adult
Anchor and Correspondent Mom Wife Runner Traveler Gardener Dog lover Skier Huge Denver Broncos Fan Proud alumna RT endorsements,Non_Adult
Art dealer writer broadcaster President Plantlife Whippet fancier Co presenter Fakeorfortune,Non_Adult
MobiFuQ com best high quality mobile sex mp4 videos Watch Amateur Asian Beautiful girls Blonde Blowjob Brunette Busty Creampie Dildo Fucking Gorgeous Hardcore Horny Indian Latina Lesbian Party Reality School girls Shaved pussy Teen and Threesome free porn movies High quality of various porn niches sorted in many different categories Mobi FuQ Xxx Tube have collected the best porn in Mp4 format get it free for your mobile or watch with your pc,Adult
Errrotica com provides the best exclusive erotic videos from the most popular erotic vebsites Enjoy the sexiest erotic movies with hottest naked girls in our videos Daily Updated,Adult
Millions of FREE hentai and anime videos images wallpapers and more No account needed updated constantly,Adult
Daily Nation is The People s Newspaper of Zambia We also print books fliers and various brand materials Tweet us using OurNation,Non_Adult
NHS Doctor BAFTA Award Winning TV Presenter Sunday Times Best Selling Author Columnist Charity Ambassador Views my own He Him,Non_Adult
Horse Dick free porn site about horse penis during sex All type dick of horse long stallion cock fat runner dick small pony penis Enjoy dick porn,Adult
Independent ad free uncensored comedy Watch new episodes of Dimension x000D x000D 20 Um Actually Game Changer every week,Non_Adult
Pornhub is the worlds leading free porn site Choose from millions of hardcore videos that stream quickly and in high quality including amazing VR Porn The largest adult site on the Internet just keeps getting better We have more pornstars and real amateurs than anyone else Its fast its free its Pornhub,Adult
Free sex and erotic online games Play over 2000 most popular sex erotic porn and xxx games online for free MyCandyGames com the leading online games site where you can play a huge range of free adult games,Adult
Kanojo Toys is the most popular online sex shop shipping worldwide and discreetly adult goods from Japan for him her and couple play since 2007 Discover our fantasy stimulating masturbators vibrators dildos anime sex dolls costumes lubes and much more,Adult
1 million of most fappable porn streaming videos from xHamster XVideos PornHub XNXX Beeg DrTuber and more at FapPorn me Updated hourly sex movies,Adult
Watch Adult Rental for better quality Adult Movies on Demand and Full Length Porn Movies Online Become a member today for Unlimited Porn Movies,Adult
Official account of CP24 Toronto and the GTA s 1 source for breaking news Our Twitter account is LIVE 24 hours a day,Non_Adult
CNN Political Correspondent Send me your tips and your animal photos,Non_Adult
Breaking news and information from WVLT Knoxville TN s CBS affiliate,Non_Adult
Popular categories Mom Japanese Lesbian Vintage Interracial Wife Mature Teen Milf Stepmom Anal Shemale Amateur Cuckold Granny and much more,Adult
national political correspondent political analyst,Non_Adult
Delmarva s News Leader RTs are not endorsements,Non_Adult
Entrepreneur Dad Champion of a Human Centered Economy YangGang Forwardist UBI Founder party bestseller Forward now on sale,Non_Adult
The latest sports and racing news from Hong Kong China and Asia from South China Morning Post Asia s leading English language newspaper,Non_Adult
Free porn Mature Granny Solo Creampie Hairy Mom Wife Amateur Lesbian Interracial Homemade Masturbation Anal Stepmom Cougar and much more,Adult
Watch our BEST JAV at Heydouga today We offer tons of JAV videos on our pay per view and unlimited streaming plan only for 14 99 per month,Adult
Breaking news press conferences interviews viral clips from the world of football Contact footballdailyuk com,Non_Adult
Chief Correspondent and Presenter Channel 4 News,Non_Adult
The official account for the BBC News technology team,Non_Adult
talkSPORT Radio Sky TV reporter Non League work for QPR programme groundhopper Irish Italian born in Tallaght Slainte,Non_Adult
Award winning Journalist Documentary Film Maker CNN African Journalist of the year Africa Leadership FellowI Nieman Fellow hopewell2 harvard edu,Non_Adult
The Daily Camera newspaper in Boulder Colo covers local news sports lifestyles entertainment business opinion and more throughout Boulder County,Non_Adult
Hot amateur men gay sex and LIVE webcam shows,Adult
book WELL THIS IS EXHAUSTING sex columnist newsletter HERE S THE THING she her,Adult
Free HD black porn tube videos and high quality ebony girl pics Dank ghetto bitches gag on hood cock Real amateur ghetto porn uploaded by users,Adult
Beeg uncensored FreePorn Videos give you real enjoyment and wild stamina for your libido,Adult
LATimes Legal Affairs Columnist Former US Attorney DOJ official Teach con law at UCSD UCLA Lawyer Exec prod host,Non_Adult
The authority for music industry professionals worldwide,Non_Adult
India s premier destination for cricket football tennis and other sports from all over the world,Non_Adult
Popular categories Mom Lesbian Wife Teen Japanese Mature Homemade Vintage Stepmom Anal Japanese Uncensored Shemale Milf Amateur Masturbation and much more,Adult
Free sex movies site Thousand of LONG sex movies in useful format Really hot free sex and porn movies,Adult
Join the leading open poly kink and swingers app free Host a club event or business Create a page at SwingTowns com,Adult
The nation s most influential source of news and information on U S housing finance We help readers make sense of the real estate economy Irving TX,Non_Adult
Podcast Something to Talk About With Samantha Armytage columnist,Non_Adult
Cleveland s own Fox 8 News Breaking news weather alerts tweets that impact you Your tweets could be used on air,Non_Adult
Independent Australian news investigation analysis and opinion Get 40 off and FREE merch when you join Crikey today Sign up here,Non_Adult
Kathimerini English Edition is a daily newspaper published in Athens It is distributed exclusively with the NYT International Edition in Greece and Cyprus,Non_Adult
Enjoy countless sex videos on this free webcam porno tube that are bound to make you hard featuring the naughtiest chicks who love to please their men,Adult
Looking for free sex porn These free porn xxx videos will blow your mind like any other incredible xxx sex video that we possess on our website,Adult
Broadcaster Interviewer Toronto Raptors radio PxP more Tennis PxP Boxing PxP 12 Olympics VIEWS MY OWN Die Hard,Non_Adult
Tranny Tube ultimate free shemale porn source Download or stream tranny sex movies now,Adult
Fast streaming dinotube filled with horny milfs sweet lesbians and exotic teens we have them all Free porn videos for everyone,Adult
This is the official Twitter page for author Luca Rossi GALACTIC ENERGIES is the new scifi fantasy anthology,Non_Adult
Guardian Brexit correspondent Have a story we should cover lisa ocarroll co uk or try securedrop,Non_Adult
Author journalist activist My latest is ATTACK SURFACE Books Blog,Non_Adult
TV Radio Host 2021 CMA Broadcast Personality of the Year Award Winner Book audiobook Hears The Thing out now Order at,Non_Adult
The best free amateur porn home made porn blog on the internet Private voyeur amateur sex pictures and movies Real amateurs in the most exciting amateur sex porn action,Adult
Amateur nude porn galleries ExGirlfriends exwife swingers pictures,Adult
London Anchor Correspondent,Non_Adult
This is the free porn tube where you x000D can watch and submit any legal niche movies,Adult
