Description,Category
Get the premium com domain you deserve Seamless and professional transactions Payment plans available,Non_Adult
Awesome Asian chicks are right here waiting for your attention over their beautiful bodies as they pleasures themselves into amazing orgasms showing off their sweet pussy for you to understand what it means to be truly beautiful,Adult
National correspondent for The Washington Post Newsletter How To Read This Chart Writing a book about the baby boom for Viking philip bump com,Non_Adult
Start breathtaking journey through Japan Ass where you could meet sexiest Japanese girls ever behaving naughty alone and with friends of theirs,Adult
Watch black girls whose pussies fucked by super big dicks in this super hot porn galleries HQ and HD black sex pictures,Adult
Find here a lot of free sex photos of hot teen cuties and see tight girls pussies and their amazing juicy tits,Adult
Freelance sports broadcaster MGMT jason sports com Insta,Non_Adult
Welcome to the official WhiteGhetto com Home of the best Indian Desi porn movies MILF and Mature XXX ball busting teens BBWs hairy pussies more x000D x000D,Adult
Free Pussy Videos movies cams 1 Free Pussy website since 1998 Thousands of free pussy videos in HD quality We only list the best,Adult
Bareback gay porn movies on Lucas Entertainment include HD gay sex scenes free gay porn and porn stars like Michael Lucas Rafael Alencar Billy Santoro,Adult
Badjojo is the 1 free porn search engine with millions of free videos We have amateur teen or milf videos from the best porn sites,Adult
Tubesafari is a powerful search engine for free porn videos We offer personalized recommendations and related videos from all the best free porn sites,Adult
Stress free and easy shopping experience Simple and speedy service,Non_Adult
Breaking news direct from Intel s online Newsroom,Non_Adult
Large collection of free and quality porn galleries of beautiful and sexy older women,Adult
Poker Pro Host Commentator 2019 Broadcaster of the Year Amazing Racer singer gamer explorer knowledge seeker,Non_Adult
101domain is The Leader in International Domains If its available we can register it We can also help you build it host it and secure it,Non_Adult
The Pittsburgh Post Gazette serving Western Pennsylvania for over 200 years Follow the latest breaking news opinion analysis and more at,Non_Adult
Personal BDSM experiences and behind the scenes stories,Adult
Courier News Home News Tribune part of the Network Your source for Central Jersey news For local sports Sports,Non_Adult
US news opinion features and sports from the Guardian Support the Guardian today,Non_Adult
Mike Cook is an author and artist His novel Scorpions is available on Amazon and his surreal artwork can be purchased on Fine Art America,Non_Adult
Subscribe DontLookUp co producer Meltdown producer narrator founder columnist s spouse,Non_Adult
Philly s No 1 free daily newspaper keeping you updated with news sports entertainment and lifestyle All you need to inform and entertain,Non_Adult
All the interracial porn you will ever need Come to the original and best Interracial com,Adult
Breaking news from around the world Follow for news unique perspectives analysis videos and more,Non_Adult
CBC Newfoundland and Labrador Breaking news updates features columns photos videos programming highlights and much more,Non_Adult
Granny Pics free Granny porn pictures,Adult
A Foreign Affair Love Me international dating service meet Russian women Latin women Asian women colombian women china women for love 75 tours a year to meet Russian Latin Colombian Chinese women Asian women and Mail Order Brides,Adult
Triangle Photos News Local Advertisers Give Us A Follow FB Instagram LinkedIn Our publisher,Non_Adult
Free UK adult dating services online with Sex in the UK the online adult dating site for no strings attached adult fun,Adult
Hot Naked Moms is a variety of genres from asian mature porn and big cock sucking to desperate orgies and black moms xxx pictures Milf anal sex round asses double penetration bukkake and more,Adult
Serving the Illinois Iowa Quad Cities Area Got a story you want to see on air or on Email us at news com or call 563 823 KWQC,Non_Adult
Private Cams offers free webcam sex free sex cams free cam sex and free live sex Watch free sexcams with hot camgirls doing free live sex shows just for you,Adult
Indie Author News where Readers discover Amazing Authors Book Features Hot New Releases FREE eBooks Author Book Promotion,Non_Adult
This is the official KTLA 5 Morning News Twitter account Watch weekdays 4 a m to noon and weekends 6 a m to 11 a m,Non_Adult
Official Publicagent com site The cream of crop for Public Sex reality episoded Watch our experienced agent seduce lovely amateurs in risky public sex scenes,Adult
White House Correspondent for Breitbart News formerly a Washington Examiner writer reporter for Robert Novak and Wyoming farm kid,Non_Adult
The unofficial guide to the FIFA World Cup 2022 Here you find news from the World Cup and other stories about football the greatest sport,Non_Adult
We Are New Orleans Very Own Tag Photos Videos WGNO For Permission To Share On Air Online Download The WGNO News App Now From The App Store Google Play,Non_Adult
Adult Entertainment Service Provider Directory more Escort Webcam Phone Chat Sex Movies,Adult
Browse and download the best porn pics for FREE Hot sex pics sorted by categories and updated daily,Adult
Egyptian sports website covering the latest news scores breaking updates in English Arabic AR Agency Youtube,Non_Adult
Broadcaster by trade Skater for life Find me here,Non_Adult
Frederick County s leading source for news sports arts entertainment and commentary,Non_Adult
Founded in 1937 Popular Photography is a publication dedicated to all things photographic,Non_Adult
Adult webmasters submit your thumbnail galleries to Elephant List Get high quality traffic to your picture or movie galleries,Adult
ENF CMNF Embarrassment and Forced Nudity Blog ENF and CMNF photos stories and videos,Adult
BravoErotica com provides thumbnailed links to the most beautiful nude models pussy on the net Daily updated erotic picture galleries,Adult
The Hacker Quarterly,Non_Adult
panelist radio broadcaster Management Nicola com New book Still Hot available 15th October,Non_Adult
OLD USE is old mature porn tube archive flash old and young tube vids from best old mature sex porn tube sites,Adult
TV Radio Broadcaster Former Rugby Player Ugo com,Non_Adult
1 source for breaking news weather and sports in the Bay Area Share photos vids and tips by tagging tweets abc7now You may see them here or on ABC7 News,Non_Adult
Senior Maverick at Wired author of bestseller book The Inevitable Also Cool Tool maven Recomendo chief Asia holic and True Film buff,Non_Adult
Fox News Sunday with Chris Wallace,Non_Adult
Entrepreneur and writer Columnist at Swarajya and Dainik Jagran Chapter Co ordinator Indic Academy Agra Jamuna kinare mero gaon,Non_Adult
Correspondent at large for Europe Bloomberg Formerly BuzzFeed News The Guardian Send me tips anardelli net DMs open ask for Signal ProtonMail,Non_Adult
Popular categories Mom Lesbian Japanese Interracial Vintage Mature Teen Wife Shemale Anal Stepmom Granny Casting Massage Milf and much more,Adult
15 pics GREY HAIRED GRANDMA REVEALS HER AGED PUSSY16 pics HORNY GRANNY GETS,Adult
CAR magazine brings you definitive car news and information exclusive scoops and road tests car reviews and first drives Available for iPad Android too,Non_Adult
Principled Illuminating News Established 1850,Non_Adult
Official updates about the innovators at Hewlett Packard Labs from Palo Alto and around the world News media inquiries contact corpmediarelations com,Non_Adult
The official Twitter account for NBC affiliate WRALNews bringing you the latest Triangle community news weather and traffic,Non_Adult
Dive into SexEmulator the hottest 3d online porn games Build and Control your sexy character as you teach her different skills such as blowjobs spanking anal and more,Adult
CEO and editorial director of the magazine an extensively kudized author noted journalist syndicated columnist and ostensible entrepreneur,Non_Adult
An independent nonprofit newspaper Free and online all the time Send story ideas and feedback to jdavidoff com,Non_Adult
Search Free HD Categories Porn,Adult
XXXJug will teach you how to become the sort of person that your mom has always told you to avoid dealing with XXX teens tube will make you forget all about decency You will find yourself enjoying totally vicious and dirty things Come on Let your libido run riot Watch the best xxx porn in the world exploring one porn category after another You will love every single sex clip in our unique collection,Adult
EPL Breaking News by,Non_Adult
Emmy Award Winning Broadcaster Journalist Married to that guy TheExpanse,Non_Adult
Reuters UK editors From pigeons to multimedia Reuters has been delivering the news since 1851,Non_Adult
Television Play by Play broadcaster San Jose Sharks NBC Sports California National Hockey League,Non_Adult
A syndicated partner of Pack Pride is an independent publication that brings you the latest on NC State athletics,Non_Adult
America s Finest Political News Source,Non_Adult
This site contains huge archive of big ass sex pictures and huge butt porn galleries Download the most popular hot asses photos for free on Sexy Butt Pics,Adult
Founded in 1926 Daily Times Digital is the foremost news and information agency in Nigeria It seeks to offer factual and timely news to it s audience,Non_Adult
White House Correspondent Past pres Georgetown prof Northwestern grad CO native Fulbright alum Postings in DC Brussels Frankfurt Berlin,Non_Adult
Local stories covered by the journalists who live here plus the best investigations opinion national and international news,Non_Adult
Quality adult porn comics by franchises categories authors and characters All XYZ sex parodies in 3D manga hentai and cartoon,Adult
Influential Investigative Independent EUobserver is an online not for profit newspaper reporting on the European Union,Non_Adult
First with the news Follow us on instagram,Non_Adult
Amateur hardcore softcore and group granny sex photos featuring hot MILF galleries and naked mature women Granny Porn Pictures presents the best mature tits collection of sexy moms xxx categories,Adult
Writer and Broadcaster This is my take on the big arguments the politics economics and personalities in the UK Europe and N America,Non_Adult
English newseng Sport sportgr,Non_Adult
Culture editor at The Bulwark Washington Post contributing columnist Pods Bulwark Goes to Hollywood Across the Movie Aisle Centrist edgelord,Non_Adult
All new Everything is Spiritual tour dates and tickets at,Non_Adult
MilfTube su Porn movies Public flashing Ass Granny Granny big tits Mature swingers Mature amateur Mom Grandpa Mature big tits Interracial,Adult
All the latest 3D Printing News from around the World,Non_Adult
AREA51 is the biggest porn link archive and presents you the best and most popular erotic links,Adult
Covering food style entertainment and all things Atlanta since 1961 tweeting about them since 2009,Non_Adult
Proud Mother of 3 Boys Former World 1 Tennis Player Broadcaster,Non_Adult
Naked Babes Hot Nude Babes pics daily fresh free pictures,Adult
Welcome to our Hentai Tube Download and Watch the best Hentai Videos completely free English and Spanish subbed Censored and Uncensored Hentai Enjoy,Adult
Breaking news from around the world plus business style travel sport and entertainment We gothere,Non_Adult
Most Informative gaming news platform for Grand Theft Auto Rockstar Games news RDR2 news follow GTAOnline GTATrilogy,Non_Adult
Writer of books columns plays songs scripts Radio TV broadcaster Founder HaveFaithHaiti,Non_Adult
Free BDSM photos and links Daily updated galleries with fresh high quality BDSM pictures every day,Adult
The latest tech news stories,Non_Adult
Free porn Voyeur Voyeur Hidden Mom Masturbation Wife Massage Homemade Lesbian Flashing Teen Interracial Granny Gay Webcam Mature and much more,Adult
IcePorn TV a hundreds hd porn videos and free porno daily added will give you pleasant moments You can watch the best quality porno videos from our Porn tube,Adult
Writer Author of the OUTLANDER series Lord John Grey novels etc Blog at,Non_Adult
HaceWeb Mzansi Social Page is a South African News and Entertainment Blog We focus on true and original celebrity political entertainment news,Non_Adult
Moscow correspondent for Write me at Andrew Roth com,Non_Adult
Visit Youporngay com for the best gay porn movies Get hot 18 twink hunks sucking huge cocks and having anal sex in free videos,Adult
The Best xXx Sex Sites with High Quality Porn Videos and Pictures for Download Also the Best Adult Sex Dating Hot Live WebCam Sites,Adult
When weather is the news you can count on CNN s team of experienced meteorologists to bring it to you first CNNWeather,Non_Adult
columnist former Co Host A GIRL S GUIDE TO JOINING THE RESISTANCE emma rose gray com Rich Text Newsletter,Non_Adult
All the latest Science and Technology news from Irish public service broadcaster RT RTs not an endorsement,Non_Adult
only student run newspaper since 1912 Follow covid19 for coronavirus news Sports for sports stuff and for more,Non_Adult
Hentai rules sharing the love since 2006,Adult
Porn tube maturesxvideo com gives you the biggest collection of xxx porn videos mobile porn xnxx porn xvideos porn 3gp porn indian xxx videos pakistani sex movies,Adult
Granny women loving suck cocks Love of the mommies and grannies is the best See the grannie love in all its forms,Adult
Porto Responsive HTML5 Template,Non_Adult
National Political Correspondent formerly mmcgraw com Often with Daisy the basset hound WV raised Hook em horns,Non_Adult
Tweeting about SaaS Marketing Growth Watching Fresh Prince of Bel Air Re Runs CEO Wired in,Non_Adult
Popular categories Mom Lesbian Japanese Granny Vintage Teen Interracial Mature Stepmom Hairy Shemale Wife Full Movie Anal Ugly and much more,Adult
Device Bondage takes BDSM porn to new levels with extreme restraints unique devices with beautiful pornstars to huge forced squirting orgasms,Adult
Free Adult Films,Adult
luxury sports content author writer broadcaster sitting there playing with silly machines,Non_Adult
Breaking company news and stories from around the globe about coffee our stores and the people who bring it to life For media inquiries press com,Non_Adult
Ton videos for everyone for free Watch in HD quality add to favorites and be happy,Non_Adult
Since 2008 we find and collect quality safe adult links then sort rate and share them in this porn directory With no annoying ads,Adult
Tons of free jizz covered porn videos from Jizz Bunker porn tube Come in for newest porn videos Daily updates,Adult
Author of Sunday Times No 1 Bestseller Skincare British Book Awards Winner 2021 Book of The Year Lifestyle Founder of Beauty Backed Trust,Non_Adult
Cartoon Sex Tube with free Hentai videos Anime Sex and XXX Comics Your favorite cartoon characters in adult version of famous toons,Adult
The official IndieWorld account of Bringing you the latest indie game news and updates for Nintendo Switch For ESRB ratings,Non_Adult
Top news and features from AFP s reporters around the world Elsewhere on Twitter,Non_Adult
Kinky videos of a stalker that finds the true slut hidden in these beautiful teens ties them up and has rough sex with them The Teen sluts love bondage and hardcore sex,Adult
New hasgtag friendly porn video search site on the web You can get all porn videos for free,Adult
Author of 12 books NEW RULES OF MARKETING PR and WSJ bestseller FANOCRACY marketing business growth strategist entrepreneur advisor to emerging companies,Non_Adult
Senior White House Correspondent board Veteran of Cap Hill Campaigns LA NY bureaus Insta,Non_Adult
Black Sex Finder is a black people dating site where you can meet black man woman who enjoy dating Sign up now,Adult
Postmedia hockey columnist has covered the Senators since Day 1 is a contributor to TSN s Sens broadcasts and pens the best Sunday column in the country,Non_Adult
Zoo Sex Video Clips,Adult
Breaking news and analysis on global financial markets,Non_Adult
SAfm Leading the conversation For news highlights and updates,Non_Adult
Lesbian Mpegs TGP High Quality and FREE Lesbian Porn Movies lesbian xxx movies and lesbo sex pics lesbian kissing lesbian pussies first time lesbian sex,Adult
South Florida s 1 News Station Your 24 7 source for breaking news powered by our digital team Breaking news newsdesk com,Non_Adult
TV online news coverage of the Greater PalmSprings CoachellaValley area of Southern California News tips 760 773 3333 and Newsline3 com,Non_Adult
The official website of Falcon Studios gay porn website Over 30 years of providing the best quality XXX gay movies Watch weekly updates and thousands of videos at FalconStudios com,Adult
20 years at DOJ 10 as defense counsel lifetime as inveterate NYer NYT bestseller Where Law Ends Inside the Mueller Investigation Link,Non_Adult
THE OFFICIAL ACCOUNT OF NEWSTALK 1010 TORONTO S BREAKING NEWS TRAFFIC AND WEATHER,Non_Adult
Photographer Skokoff discovering new erotic talents His photos are pure and girls are awesome hot and teasing sexy,Adult
Live updates from the team behind BNO News Currently covering coronavirus For other news follow,Non_Adult
Online video service that offers more than 10 000 high quality free gay porn videos One of the best collections of free gay sex movies in near HD high definition quality Start watching our quality gay porn videos now,Adult
Top free porn videos free phim sex xnxx lau xanh listed and graded All the Free Porn you want is here Watch as they slide down hard dicks and slurp long erect dongs If you re into something kinkier there are many femdom videos available to you to check them out and indulge in them in full HD glory Tons of videos isedap com categories and sexy pornstars So enjoy,Adult
A huge database of free porn tubes 10 000s of porn vids sorted by category This is the only porn resource you ll ever need TubeGalore it s a vortex,Adult
The latest national and international news from the team,Non_Adult
All the tweets for breaking news views Facebook Telegram,Non_Adult
The xxx sex videos platform is right here to supply you with the nastiest and most gripping porn thrillers in the porn industry loads of sex video masterpieces were collected in this virtual harbor for you to rejoice at them all sex wishes are fulfilled,Adult
Award Winning Author and Book Coach Brainstorming Queen Journaling Junkie and Positivity Powerhouse Blogging Spirituality Book Promotion Happiness,Non_Adult
Emmy winning anchor of The Beat on MSNBC I NBC Analyst MSNBC Chief Legal Correspondent JD I Latest segments,Non_Adult
Pakistan s most accurate newspaper Business Finance Economy Politics,Non_Adult
Caribbean Correspondent Miami Herald You can find my latest stories here and to subscribe to,Non_Adult
BigTitsGf will give you more than you expect to see anywhere No doubts vicious tits fuck is a perfect way of warming up but you will find more than that in our fascinating collection Be ready for tons of xxx clips to every liking from big tits sex to merciless drunk gf fuck No matter what your libido prompts you you will enjoy it here watching top rated porn clips and daily updates for free,Adult
Official Twitter account for Wide World of Sports Commentary stats results and all the news Follow us on Instagram for more,Non_Adult
Economist Podcaster Columnist Co Editor in Chief at Politics Economics Freedom is not free vanessa com,Non_Adult
SVP of Operations RotoGrinders ScoresandOdds DFS Player DB730 former talk radio host working toward a sub 5 golf index,Non_Adult
Beaver Palace All Exclusive Content Porn Videos,Adult
Follow for exclusive news on Neo QLED 8K NeoQLED8K NeoQLED MicroLED TheWall TheSero TheFrame TheSerif TheTerrace ThePremiere,Non_Adult
Tons of free asian rape videos,Adult
Feminist author columnist Come hang out with me at,Non_Adult
Doctor Mum NHS GP Mail Mailplus contributor Talk Radio GP BBC Radio London Inside Out All views personal RT s not endorsement,Non_Adult
Daily Updated Teen Pornstar Galleries,Adult
Spycam selftpics posses webcam outdoor This is Realboys gay webpage x000D Los mejores hombres reales de la red,Adult
Sports broadcaster for BBC I talk about Leeds United a lot and love a round of golf Views belong to me and not the BBC efc,Non_Adult
Lesgalls your source for exclusive big tits and bbw porn on the net Thousands of sexy plumpers are waiting for you here,Adult
Hudson Inst BGR Advisory board Fmr U S State Department official Fmr Fox News anchor correspondent,Non_Adult
News sport comment and more from The Irish News Sign up for our free daily newsletters,Non_Adult
TV Radio Broadcast Journalist with RTE Irelands public service broadcaster The views here are my own personal opinions primetime,Non_Adult
If you have a groove on the anime pornography and ready to watch this type of oaters for long hours every day you ought to visit the site gold hentai tube it is worthy of the highest accolade but seeing it on your own is better than anything else all present sex video masterpieces are free and attractive and all its video production is refreshed on the permanent basis just a few clicks are enough for you to get plunged in the universe of anime sex and eternal porn pleasure the gold hentai tube welcomes all sex addicts to visit the site and express your opinion about it there is nothing more you have to do,Adult
Senior Writer and co host of the Gadget Lab podcast Lover of plot twists lauren goode com DMs open contact for Signal info,Non_Adult
good guys website,Non_Adult
an australian mag for the creative and curious our 105th issue is out now,Non_Adult
Executive Coach Partner Morris and Larson Advisors LLC News Analyst NY Times bestselling author,Non_Adult
Former BBC R4 presenter North America Editor Europe Editor Chief Political correspondent Now Ronin freelance writer and broadcaster,Non_Adult
South Africa s leading motoring media brand Informing and entertaining South African car lovers since 1957,Non_Adult
Mature porn tube hot moms and milfs fucking boys on video,Adult
Full time broadcaster plant lover tattoo enthusiast founder of TCKT Insta laceduplauren Stay Cool,Non_Adult
Forsale Lander,Non_Adult
Official Twitter Account of LEADERSHIP NEWS Nigeria s most influential Multimedia news content provider based in Abuja,Non_Adult
Your best source for charts new music pictures videos daily news and more fan account,Non_Adult
Ireland s Sports Broadcaster,Non_Adult
Ireland s premier breaking news website providing up to the minute news and sports reports,Non_Adult
News alerts headlines more from WNYs largest newsroom,Non_Adult
Free Sex Stories Collection,Adult
NYT columnist BNC news anchor Lecturer Author of TheDevilYouKnow and FireShutUpInMyBones both NYT bestsellers,Non_Adult
Breaking News Weather and Sports The Midlands first choice since 1953,Non_Adult
RTA Restricted to Adults enables parental filtering and work to enforce the prevention of children from viewing age inappropriate content,Adult
Male Feet Lovers The Amazing Male Foot Fetish Male Feet Male Tickling and Sock Fetish site with pictures and images of hot male feet socks fetish stories foot personal ads for men,Adult
Adult videos from video games including porn from Second Life Sims sex movies Elizabeth Lara Croft Mass Effect Skyrim and Source Film Maker,Adult
Fun com carries unique gifts and geeky products Shop Star Wars toys Funko Pop Vinyls gadgets action figures collectibles and so much more Whats fun for you,Non_Adult
NPR media correspondent Author Murdoch s World,Non_Adult
Portland Monthly is Oregon s No 1 lifestyle brand We share the stories of our city,Non_Adult
Learning to trust the lord more and more each day as father husband friend sports broadcaster love NBA,Non_Adult
Editor broadcaster and award winning writer Author of You Have Struck A Rock Dumbledore in the street Voldemort in the sheets Contact info com,Non_Adult
Edmontons Local Breaking News,Non_Adult
Tampa Bay s free weekly newspaper A product of Times Florida s largest and best newspaper Read the latest issue at,Non_Adult
The nations entertainment powerhouse we set the pace with more breaking news in depth profiles exclusives than anyone else Weeknights on 7 30,Non_Adult
If you need to purchase condoms check out our selection of great brands at affordable prices We are the online condom specialists,Adult
Fucking and Cumming videos Hottest charming guys of the net in a daily updating collection of of newly shot young gays tube,Adult
Follow for the latest in breaking celebrity news photos,Non_Adult
Chief leader writer and columnist,Non_Adult
Guardian columnist and features writer Author of We Need New Stories,Non_Adult
Young teen and amateur porn videos from USA UK and Czech Real amateur photos and porn videos for free,Adult
Celebrating over 20 years as St Louis independent culinary authority,Non_Adult
Columnist The News Pakistan Observer,Non_Adult
Chief Sports Correspondent The Times Views mine etc,Non_Adult
The monthly magazine Detroiters rely on for award winning coverage of issues and people affecting their livesand a source for the finer things in the region,Non_Adult
Free gay porn previews bareback twinks jocks fitlads scallyguys,Adult
Zimbabwe Broadcasting Corporation First with the news about Zimbabwe and Africa,Non_Adult
Transparency real time superfast payouts The highest and fastest paying casino affiliate network,Adult
llll Amateurs in the Sex Cam uncensored HD porn films live TV for adults discover erotic trends discount actions 100 anonymous,Adult
