Description,Category
The Official Twitter account of MEGA the Philippines Best Fashion Magazine IG magazine,Non_Adult
The Independent Author Network Celebrating 10 Years of Promoting and Supporting Indie Authors Over 700 000 social media followers love our books IAN1,Non_Adult
Correspondent comedian Host of The Twitchuation Room on Newsbroke on Red White and Who on MSNBC IG,Non_Adult
Hometown Dorchester MA 1st job Paper Boy Current job Dad CNN Chief National Correspondent Anchor Inside Politics Fan of all sports Boston BeatMS,Non_Adult
Correspondent Vice News Tonight on HBO Co host The Fifth Column podcast Various other things,Non_Adult
All our movies in HD resolution have scenes with anal sex with beautifull babes only and cumshots at the end xCum publishes videos the same day they are released,Adult
Award winning Emmy nominated Senior Investigative Correspondent Covering national security intel Follow me for more news less noise factsmatter,Non_Adult
Official Interactive Porn Site featuring Riley Reid Janice Griffith Kimmy Granger Chanel Preston Mia Malkova Alison Tyler August Ames Elsa Jean and ma,Adult
Turkey s English news source for more than 60 years,Non_Adult
News talk entertainment and events in Ghana since 1995 Radio for the discerning listener Part of the Multimedia Group,Non_Adult
The Lawrence Journal World provides local news sports and other info interesting to Lawrence and Douglas County Kansas Story ideas tips news com,Non_Adult
Breaking news updates and stories from southwest Connecticut s largest newspaper,Non_Adult
Legal and political analyst for Fox News Channel Author of THE RUSSIA HOAX and WITCH HUNT available now,Non_Adult
The Roanoke Times is the leading newspaper in Rke NRV swva Follow our reporters here,Non_Adult
Mature Ladies is a free mature porn tube with MILF and cougars sex granny GILF porn videos New mature videos added daily Enjoy now,Adult
Broadcast Journalist RTs Endorsement Views are my own Insta sadaafjabbar,Non_Adult
Shop for top sex toys for men women couples on Jack and Jill Adult Get a FREE gift on any adult toy purchase and daily deals with discreet shopping guaranteed,Adult
Capitol Hill Correspondent Author in progress RTs likes not endorsements but you knew that,Non_Adult
Nude eriotic and teens models pics sexy cute teen galeries,Adult
IPS SSP Baramulla hard wired cop Koshur At risk of being obsessive subtle humour always More than meets the eye but gliding below the radar,Non_Adult
The official KEZI 9 News twitter page serving Western Oregon with 24 7 nonstop news coverage Live Local Late Breaking,Non_Adult
and present Melbournes 9News on at 4 00pm 6 00pm Simulcast on Community Guidelines,Non_Adult
Watch the most popular sex clips starring porn stars and amateurs find the finest porn with teenagers mommies bbws indian or asian girls whatever we offer a diverse selection of porn genres with countless clips even if you are not sure which porn to watch online for free you can still find something exciting on this porn tube just check it out right now,Adult
Serving Adult Webmasters since 1997 Our adult search engine directory features hundreds of adult webmaster categories from adult web design billing providers content providers and much more,Adult
Teen Porno Tube tons of Top Quality HD Teen Sex Videos Enjoy the best TEEN PORN,Adult
Real Zoo Movies free site about zoo porn Oldschool animal sex movies amateur zoo sex from webcam leaked animal porn videos,Adult
Best nude babes photos updated regularly with tons of best sexy teens xxx galleries and young pink pussy pictures,Adult
The official account for the East Anglian Daily Times newspaper delivering the latest Suffolk Essex news and sports headlines straight to you,Non_Adult
Broadcaster 2fm Breakfast Podcaster The Laughs Of Your Life andy ie,Non_Adult
University of Kansas Graduate 14 Year NBA Vet Broadcaster for NBC Sports Washington,Non_Adult
Sports columnist for the Boston Globe Author Winner BBWAA Career Excellence Award presented at Baseball Hall of Fame,Non_Adult
The BEST Free porn online Watch the hottest ass and anal porn movies best highest quality porn with the sexiest Amateur girls and the top pornstars Updated daily on vipporns com,Adult
North Florida and South Georgia s number one news source for over 60 years Tallahassee Valdosta affiliate Sports Weather,Non_Adult
National Columnist on all things football Insta is rivalsgodfather,Non_Adult
Golfer broadcaster course designer teacher fitness advocate Check out,Non_Adult
International Correspondent Dubliner who has been making detours for decades Never far from a cup of tea Own views Retweets are not endorsements,Non_Adult
Darkplay net is the original hardcore lesbian BDSM site created on 2000 by Zille Defeu,Adult
Hip Hop on a Higher Level,Non_Adult
The hottest celebrity news fashion beauty health and real life stories Instagram Facebook,Non_Adult
Czech couples fuck in the street money for public sex oral anal big natural tits MILF 18 years old real amateurs,Adult
Chief Congressional Correspondent Roaming the Capitol halls covering the Hill and politics Die hard Chicago sports fan Wisconsin Badger for life,Non_Adult
Egypt s Only Daily Independent Newspaper in English,Non_Adult
National correspondent for Author of zero books DMs open For sharing sensitive information or documents contact me on Signal app at 646 394 3002,Non_Adult
This Is Skiing,Non_Adult
Tranny porn tube is packed with hours of the best shemale sex videos collected in one place Daily updated and categorized free tranny movies,Adult
The number one magazine for Mini owners and fans worldwide,Non_Adult
Headlines and breaking news from NBC affiliate NEWS CENTER Maine in Portland and Bangor Maine Start your tweet with NEWSCENTERmaine to say hi,Non_Adult
Desipapa is a free Indian sex website featuring pictures movies homemade porn of sexy Indian babes directly from India Unzipping Indian girls bhabhi wifes babes and amateur every day,Adult
Porn videos Mom Lesbian Japanese Teen Stepmom Mature Vintage Milf Interracial Anal Shemale Wife Granny Threesome Classic and much more,Adult
Assassin of Alphabet Bestseller of Books Critic of Culture TED Talk Titan Side Eye Sorceress,Non_Adult
SexMosaic Sex online Movie online download movie Free Porn Porn Video online Free HD Free JAV video Free download porn video Asian Adult Videos Japanese Porn online judge Asian video collection,Adult
PornHolding is more that a mere pompous name it is a very huge free sex tube resource that is able of satisfying any porn watcher in the world without exceptions We have more porn video categories that you can cope with and hundreds of girls porn clips to any vicious taste in any section If we mention numerous xxx links and hot daily updates you will realize that Porn Holding is your sex venue,Adult
Watch the best FREE porn pics Browse over 1500000 XXX photos sorted by categories and updated every day,Adult
TAC Amateurs The world s Biggest Amateur Sex Sites Network Over 300 real amateur porn models wives and girlfriends running their own adult websites,Adult
Colorado s Own Channel 2 KWGN provides Breaking News COwx COtraffic sports entertainment and CW Network programming,Non_Adult
Nationally Syndicated Radio TV Host Podcast Magazine Sports Category Dir Clubpod Leader Fireside Creator Branding Specialist CMO of HaleysComet,Non_Adult
Follow us for the latest news about events products and more Follow us on Instagram too,Non_Adult
Broadcast Journalist urdu on the primetime show Founding editor Board member Jahangir Previously,Non_Adult
Spy Cams of guys in locker rooms showers toilets beaches stalls cruising in public places pissing and more,Adult
Manchester City correspondent for,Non_Adult
Official Account BOL Media Group includes BOL TV channels BOL News BOL Entertainment BOL Sports,Non_Adult
Official Twitter for Steve Backshall naturalist broadcaster and author Link to my new book Expedition here,Non_Adult
The world s most widely read aviation magazine,Non_Adult
Mangoporn is the world s leading free porn site Choose from millions of hardcore videos that stream quickly and in high quality including amazing VR Porn best place to watch porn movies and porn videos in hd quality,Adult
Political Correspondent BBC in a personal capacity Author Still worth saying RTs aren t endorsements Instagram iain watson,Non_Adult
Live breaking sports news Hit follow to keep updated Full system site in private beta Email news uk,Non_Adult
FoxHQ is a daily updated blog the best babes are posted If you like them busty or new porn you will get every link that hits the spot,Adult
Porn300 com The coolest Free Porn Video site on internet Porn videos every hour The best XXX Porn Tube Sex and Free Porn Movies you want on mobile and pc Enjoy Porn with us Porn300 com,Adult
From The Sunday Mail newsroom Zimbabwe s leading Family Newspaper Disclaimer Retweets are NOT endorsements replies taken as feedback may be republished,Non_Adult
Bondage BDSM Gear Sex Toys Ass Play Harnesses Pup Play Fetish Clothing since 1979 Our Leather Neoprene gear is designed and manufactured in the heart of San Francisco,Adult
Massage Creep brings you the hottest oily massage porn videos of amateurs having sex while getting nude massages,Adult
Upcomics Download free adult comics 3d comics hantai manga adult games,Adult
Enjoy daily updated free bbw movies and get exclusive bbw porn videos right now at BBWMovies com,Adult
Just the News is a nonpartisan news media brand based in Washington D C committed to just reporting facts from journalists RTs likes are not endorsements,Non_Adult
JapanToday is the leading English news site about Japan featuring all the latest news and stimulating reader discussions on domestic and international issues,Non_Adult
Free ebony porn pics sorted by categories teen ass mature milf hairy big tits and much more,Adult
The leading online news and information source for Tacoma Washington and the South Puget Sound,Non_Adult
Online chat rooms with thousands of people from all over the world Includes free chat communities for adult teen gay or lesbian singles and more Connect instantly with no registration downloads or fees,Adult
Award winning investigative Journalist ex Social Media Editor BBC Urdu Reporting on aviation Fact Checker A frustrated journalist is a cliche Views MINE,Non_Adult
Sportsnet baseball columnist Author Big 50 Toronto Blue Jays order revised and updated edition Journalism instructor Centennial College,Non_Adult
The Arash Markazi Show The Morning Column On Air Past Columnist,Non_Adult
Political Editor for,Non_Adult
odd mom out on 4 92 stars on uber correspondent on on CBS,Non_Adult
Biggest porn collection of high quality porn Tube videos Welcome to the world of xxx videos,Adult
UC Berkeley s independent student run newspaper Established in 1871 independent since 1971,Non_Adult
The Leading Media Agency on BSC with Featured Projects Updated News Telegram Group DYOR BARMY,Non_Adult
News updates from around the all day every day Home of and,Non_Adult
Welcome to Zamalek Official Twitter account The 20th Century most Titled Club in Africa FR,Non_Adult
Atlanta s 1 UNCUT Internet Station 24 7 Live Broadcast Listen Online or Phone We spin INDIE HipHop RnB,Non_Adult
Breaking news and sport from the Express Star Email us at newsdesk co uk,Non_Adult
Porn videos Teen Japanese Lesbian Mom Wife Anal Interracial Webcam Teen Anal Mature Stepmom Hidden Masturbation Shemale Milf and much more,Adult
The Connected Enterprise Network World from is the premier provider of news intelligence and insight for network and technology executives,Non_Adult
Watch Free Porn now Here is Free XXX Movies website PuPorn thrilling Hardcore Sex Videos collection in all legal genres wait for your close attention Be ready to cum several times,Adult
Trying to adapt Also Washington Post deputy editorial page editor and columnist,Non_Adult
A pivotal voice in American intellectual life since 1945 Sign up for our newsletter here,Non_Adult
IMG Models is the international leader in talent discovery and model management widely recognized for its diverse client roster The agencys offices are located in six world capitals New York Los Angeles Paris London Milan and Sydney,Non_Adult
The best British and European models in a lingerie lovers paradise with over 3 400 000 exclusive images and videos Updated every day with at least 6 new sets,Adult
USA Lacrosse Magazine is the flagship publication of Lacrosse Follow for the latest lacrosse news,Non_Adult
EnviroNews The World s Premier Source of Investigative Reporting on the Environment Energy Health Climate Nature and Wildlife,Non_Adult
Daily news from about Taiwan local paper headlines and photos of the day Retweet Follow FB tw Insta tw,Non_Adult
Breaking news sport and more from East Lancashire We re also on FB,Non_Adult
The web resource always updates with high quality porn videos and that is why you would always know how to spend some of your free nights,Adult
We put data to work for development Follow us for opendata updates support news stories data visualizations,Non_Adult
Providing travel advice insights on Southern African destinations beyond,Non_Adult
Enormous Database Of Daily Updated Free Tube Videos,Adult
New Sex Videos New Porn Videos Free Download HD High Quality Xxx Video Mp4 Adult Sex Clips HotXV com,Adult
Watch from our great selection of HD porn videos including amateur milf BDSM and more at looporn com,Adult
Khaama Press KP is the largest news agency in Afghanistan with over 3 million monthly visitors,Non_Adult
Actual Porn Forum Only New and Free XXX Video,Adult
ATDHE is the best place for Watching Free Sport Streams Soccer football baseball and many more at ATDHE For Free,Non_Adult
Top stories Trusted sources Your window to the news that matters most to you Current live events pinned below Download our app here,Non_Adult
Naughty America offers the best VR porn videos online Our virtual reality porn turns your xxx fantasies into the most vivid virtual reality sex experience,Adult
TV presenter journalist weather reporter travel food writer Columnist awards functions host Agent julia co uk,Non_Adult
Cleveland s breaking news leader and home of the First Alert forecast Affiliate Terms of service,Non_Adult
Severe weather updates from Get instant weather alerts and more updates on our free mobile app,Non_Adult
Bitcoin Ethereum and other crypto news around the world,Non_Adult
Mild mannered Chicago columnist host of The Chicago Way Podcast and proprietor of,Non_Adult
Official account for Juan Williams Fox News analyst The Hill columnist former Washington Post scribe author of What the Hell Do You Have to Lose,Non_Adult
Breaking news and features about Japan from the nation s most widely read English language newspaper,Non_Adult
Welcome to ShemaleWiki an international shemale escort list with main focus on Europe Middle east and Asia here you get an overview of the shemales you can meet right now Note that we have escorts in numerous countries all over the world,Adult
Christian Husband Dad Host Journalist Columnist Books Podcast Views are mine,Non_Adult
she her Mech Engineer turned writer broadcaster 4 135 LISTEN LAYLA out now TALKING ABOUT A REVOLUTION out 06 22,Non_Adult
News grants and eco tips from U S Environmental Protection Agency s Green Building Program Follow RT endorsement,Non_Adult
The MMQB is home to SI s in depth national NFL coverage News analysis features more We also tweet links from SI s breaking news team and local team sites,Non_Adult
Young beauties passionately want sex girls want to fuck a lot and they give themselves to fuck in wet pussy Download porn videos for free a large selection of hot porn,Adult
Thailand s Internet E Commerce Pioneer Columnist Consultant Radio Host Business Man and Father Founder and Startup Investor,Non_Adult
Policy Correspondent at I also do videos of nice cycle routes in London link below jon stone co uk,Non_Adult
From beaches to breweries mountaintops to museums we seek and share the best plates pours faces and places in San Diego,Non_Adult
The Sun is a daily newspaper based in Lowell Massachusetts serving towns in Massachusetts and New Hampshire in the Greater Lowell area,Non_Adult
Ghanas leading online news publication for business executives in West Africa and around the continent email newsghana101 com Tel 233 244 244807,Non_Adult
Full time Broadcaster Software Engineer business inquiries dasmehdi tv,Non_Adult
We are the UKs National Innovation Agency We fund business research collaborations to accelerate innovation YouTube Part of News,Non_Adult
We love all things NOLA,Non_Adult
Chief Foreign Affairs Correspondent of The Wall Street Journal Author of Siege of Mecca Endorsing nothing Email me yarotrof at gmail,Non_Adult
Follow for Breaking News and CUT videos that impact you,Non_Adult
The huge collection of MOM and BOY porn Free XXX MOM AND BOY video tube We updates every hour,Adult
Keeping you in the know 24 7 For breaking news special reports etc Latest on sports follow TalkToPD PDWikendi,Non_Adult
Welcome to my caption blog of work I ve done and other work that has either been done for me or I have found online and really liked I have been capping for a while now but have never put all of my work together on one place So I figure it is about time When capping my mind tends to flow in a XXX manner and if transformations are involved then of course you have to live out your deepest fantasies So here goes Stormy,Non_Adult
We re a monthly magazine bringing you stories you care about arts style food and what s happening in Cincinnati,Non_Adult
Columnist Appa Husband BJP Worker Member of Parliament,Non_Adult
Soccer columnist for ESPN,Non_Adult
Financial Times columnist reporter and associate editor focused on the world of work Bootstrappy regional Opinions mine not the FT s,Non_Adult
Author columnist Latest book Pandemonium The Great Indian Banking Tragedy Weekly column Banker s Trust Part of Mint founding team Linkedin influencer,Non_Adult
The latest world news from the,Non_Adult
Here you will find a large collection of free Mature Granny MILF and BBW straming porn videos sorted by popularity for your viewing pleasure Porn videos Mature Granny Mom Wife Amateur Creampie Homemade Interracial Cuckold British Lesbian Cougar Solo Mature Anal Big Tits and much more,Adult
Free sex videos every day straight from porn movie studios Tube Wolf brings you never ending updates of new full length sex scenes,Adult
Award winning Historian Professor and Writer 2022 National Fellow Columnist New Book UNTIL I AM FREE,Non_Adult
The best in femdom and bondage Men on Divine Bitches respond with obedience ass worship cunt worship oral servitude pantyhose worship and foot worship,Adult
Safe and the best website to watch online or download OnlyFans Leaked Nudes Instagram models Twitch streamers Chaturbate Archive and Couple Cams,Adult
The Offical Behind The Scenes Site for The Dogfart Network Featuring the Entire Blacks On Blondes Archive Gloryhole Spring Thomas Blacks On Cougars Interracial Blowbang Many More,Adult
Special Correspondent SE Asia Mostly Myanmar Formerly Yangon Phnom Penh London Part of Pulitzer winning team 2019 DMs open for tips cat pix,Non_Adult
Take pleasure in some of the best sex videos that will make your cock absolutely explode Porno movis with the dirtiest of babes on our HD porn TV,Adult
Member of Society of Professional Journalists tweets Producer The Nutcracker Member Editor of HotFlash Host of Reporter Room on,Non_Adult
Irresistibly wet pussy getting banged by several guys at a time and a lot more Our pretty nude girls know how to make their fuck buddies happy,Adult
quality free shemale porn tube and tranny sex videos Watch HD and 4k Transsexual hardcore clips at sheshaft com,Adult
CBS News Sunday Morning The Atlantic Author of The Hardest Job in the World Lift people up don t lower them down E B White,Non_Adult
See our collection of porn videos for your pleasure Here you can find 1 million XXX videos clips and movies from XNXX XVideos XHamster PornHub RedTube YouPorn Beeg DrTuber and more,Adult
The world s 1 plant based food lifestyle magazine,Non_Adult
Celebrity Thumbs has new daily free nude celeb pic and video galleries,Adult
Football coverage Breaking news Transfer updates Stats facts opinions,Non_Adult
Decibel the hottest magazines flexi discs books exclusive vinyl festivals and tours in metal,Non_Adult
brings you the latest news with 360 degree coverage across genres Instagram Download App,Non_Adult
Welcome to Gamma Entertainment the best adult affiliate program in the industry with the best payout programs earn 35 for each sale or join the 50 revshare program to earn money online,Adult
Sex Motors Popular Porn Movies and Sex Clips mom panties indian family sex sleeping teens asian big black cock schoolgirl erotic nd other XXX films,Adult
The Leading Business Weekly More Breaking news Sports news Features and Analysis follow I The Best Sunday Read,Non_Adult
The Witness is the oldest continuously published daily newspaper in SA first published on 27 Feb 1846,Non_Adult
US managing editor of and long suffering Orioles fan Ex news editor Former national security correspondent for and in DC,Non_Adult
Journalism is an act of faith in the future TedTalk,Non_Adult
Rexxx porn search engine allows you to search through over 3 000 000 free porn tube videos,Adult
Best MILFs porn videos sorted by XXX categories Mature ladies mom son sex old lesbians and lots more We offer daily updates and HD streaming as well,Adult
NHS DoctorBest Selling AuthorGP on President Ambassador,Non_Adult
Serving writers readers since 2007 the WritersAlliance provides invaluable writing resources for authors screenwriters readers Welcome writers,Non_Adult
org fellow columnist Author The Road Not Taken Corrosion of Conservatism All opinions mine feel free to adopt them RTendorsement,Non_Adult
Over a decade half media experience I cover every news angle from politics 2 social at the VOASomali as an Inter Broadcaster Views are mine RT not endorsed,Non_Adult
All the sports talk interviews game coverage and podcasts from the top personalities in sports Listen now on the free app,Non_Adult
Tiny4K offers the 4K Ultra Definition HD Porn Videos of tiny girls taking on the internet s biggest cocks These sexy women are all under 100 lbs and enjoy getting fucked by huge dicks so Join today,Adult
Living and Breathing Dance Music since 1991,Non_Adult
Thousands sexy photos of nude girls chubby teens perfect bodies nudist girls hot amateurs asian and latin teens young models We collect all hot girls for you Updates daily,Adult
Sports Broadcaster Managing Editor News Saturday 1 5 and FIFA World Cup Olympics 19 x Cheltenham Views are my own,Non_Adult
Leading Independent Private News Media in Myanmar Member of the Asia News Network English Version,Non_Adult
Sexy Playboy Models In Hot TV Shows Videos And Pics,Adult
Download gay porn movies for free 1000 s of hot gay models to choose from muscle guys twinks latinos bears hunks High quality gay porn videos only Take a look on some of the sexiest gay boys on the net Free gay tube videos The best selection of gay sex movies available for free download,Adult
Welcome to the Official Site for Holly Randall Erotic Photographer Producer and Director Daughter of erotic photographer Suze Randall Holly Randall brings her own site featuring her own top glamour babe content You will find erotica and solo photos and videos plus some hardcore action as well,Adult
Antiq Free Adult Forum Only exclusive fetish videos and pics,Adult
Doctor Writer Researcher Chairman Book Duty of Care No 13 Sunday Times bestseller,Non_Adult
Stormzys G Broadcaster 1 4pm weekdays writer event host podcasts Contact,Non_Adult
Washington bureau chief Germany s global broadcaster,Non_Adult
Look or download porn videos here on Cruel Mistress net Discover the collection of high quality Most Relevant XXX clips with Female Domination and Fetish,Adult
Bluebella award winning fashion led lingerie and nightwear collections designed to redefine sensuality Highly wearable seductive and affordable,Adult
NYT Health Columnist Founder former editor Emmy GLAAD award winner prev and,Non_Adult
Mom Son Porn Tube,Adult
The world s 1 digital vegan lifestyle magazine FREE to read Highlighting the best in vegan food products business beauty news and more,Non_Adult
Official Twitter account of the 1 source for Volleyball news for more than four decades,Non_Adult
86 Mets WS Champ 3x NL All Star NYTimes Bestseller HouseofNails would wouldnt,Non_Adult
Hall of Fame baseball pitcher Dennis Eckersley serves as a broadcaster for the Boston Red Sox on NESN For business inquiries contact kzayotti com,Non_Adult
Host American Dream Home Fox Business Correspondent Fox News Author of The Comeback Triathlete Runner Cat lover,Non_Adult
PBS NewsHour is one of the most trusted news programs on TV and online,Non_Adult
Exotic Kenya Premium Kenyan Escorts hookups with hot Kenyan Call Girls Men Nairobi hot Mombasa Raha Kisumu Eldoret Nakuru warembo Kenya Sensual massage kutombana and more,Adult
Official twitter handle of PTV News the News Current Affairs Channel of PTV the State Broadcaster of Pakistan,Non_Adult
Free Sex Movies Megasite,Adult
TEEN HEARTS clothing brand best known for our custom tie dye prints alien merchandise Our motto STAY WEIRD is visible throughout our unique apparel,Non_Adult
Follow the 1 Autism News on Twitter The latest international news about autism featuring top stories top videos and new products from around the world,Non_Adult
Huge collection of free hd porn videos Tons of amateur sex and professional hd movies Daily updated videos of hot busty teen latina amateur more,Adult
