Description,Category
Most exciting pornstars from Japan are posing masturbating and fucking like never before in xxx vids on Japanese Ass Tube,Adult
Author of Alienated America Columnist at the Washington Examiner Senior fellow at AEI Husband Dad of six T ball coach Disclosure,Non_Adult
NFL MLB broadcaster for FOX glutenfree,Non_Adult
Author NYTimes Bestseller IMMORTAL LIFE OF HENRIETTALACKS now an film HeLaMovie Writing a book on animals ethics AnimalResearch Insta,Non_Adult
RebootCash l affiliation de John B Root,Non_Adult
Covering East Central Illinois with news sports and everything you want to know Can we help you,Non_Adult
The porn world of nude teen girls showing hardcore fuck skills on video,Adult
Sport news comment video and more from the For all your US sports needs follow and Australian sport IG guardian sport,Non_Adult
Creator Host of perpetual student on flags has over 6 5M views NYT Bestseller The 99 Invisible City,Non_Adult
Have Her is a collection of real sorority hazing tapes that show how girls really act These videos are the best all 10k winners Amateur lesbian porn at its best made by the older sisters,Adult
YouPorn is your home for free XXX porn videos Sit back and watch all of the unlimited high quality HD porn your heart desires Enjoy the hottest porno movies from just about any category you can imagine Discover the sexiest naked pornstars and amateurs on Earth only on the world s favorite sex tube YouPorn,Adult
Watch Best Porn Cams and enjoy free live sex shows with sexy adult cams girls at Firecams com,Adult
TV Presenter Columnist Writer Reporter Trustee Foundation 41 years of Television and Radio presenting counting,Non_Adult
Watch the hottest videos from Brazzers in one site for free We bring you the best videos from our collection for your enjoyment,Adult
Archived account for The Oklahoman the state s most trusted news source and the largest daily newspaper in Oklahoma,Non_Adult
The vanguard of mens fashion destinations,Non_Adult
A website for news on the television adaptation of the Outlander book series by Diana Gabaldon The site is written by six lovely lasses,Non_Adult
Local News Matters We cover the news from Pasadena Calif and surrounding communities LocalNewsMatters,Non_Adult
Welcome to Blush Our style inspires women to embrace their unique sense of self with complete assurance and a flair for playfulness,Non_Adult
Kerala s popular News Network We deliver the latest updates first Be it Political news or Entertainment sports and health you ll get it,Non_Adult
Tweeting the latest breaking news from the WCCO TV newsroom since 2007 Want more than just breaking news updates Follow,Non_Adult
Foreign Correspondent,Non_Adult
No 1 golf equipment news site No 1 tour equipment news site World s largest golf forum and classifieds WITB,Non_Adult
The Best Porn Reviews Membership Discounts Know what you ll get on pay porn sites porn networks porn stars Pay less with our fresh discount offers,Adult
HELLION MAGAZINE IS AN EMPIRE IG hellionmag,Non_Adult
The best booru for real porn stuff Serving 716 585 posts,Adult
Scott Pelley is the author of Truth Worth Telling and a 60 Minutes correspondent He anchored the CBS Evening News from 2011 to 2017,Non_Adult
Find scund com and thousands more domains for sale on the biix Marketplace Get your perfect domain today so you ensure your success tomorrow,Non_Adult
Another view to cancer and cardiovascular diseases through the role of 5 To 10 A Day in the modern healthy eating tendence,Non_Adult
UGO is a pop culture comedy site We celebrate our obsessions by cracking jokes and making awesome videos We kid because we love,Non_Adult
Find transsexual shemale travestie transvestite and transex escorts worldwide Europe Asia America and Australia,Adult
Underground xFobo com Forum with latest downloads of movies games applications torrents mp3 s updated daily,Adult
Columnist The Times contributing writer the New York Times book reviewer the Sunday Times Winner of the Orwell Prize for political journalism 2011,Non_Adult
Top Porn Sites,Adult
Friends This is 24 7 breaking news site,Non_Adult
The worlds leading vegan media platform,Non_Adult
White House Correspondent jeremy diamond com,Non_Adult
Follow Toronto s 1 newsroom for top stories exclusive content must see video For local breaking news alerts download our app,Non_Adult
Greg Miller is a National Security Correspondent for The Washington Post winner of Pulitzer Prize and author of The Apprentice greg miller com,Non_Adult
This blogis used to store my collection of sexy tights pantyhose and high heels etc Welcome to rebolg You can ask me anything if you want You can also submit anything you want Enjoy yourself,Adult
We take you to the heart of the stories that shape our world For breaking news follow,Non_Adult
Broadcaster Sky News Australia,Non_Adult
Delivering Jewish news from around the world since 1917 Got a news tip Send it here,Non_Adult
Special Correspondent The Pioneer,Non_Adult
Unshaved teen chicks and furry Milf spreads legs and closeup bushy pussies Look hairy girls at candid porn pictures,Adult
Latest Mature Porn Tubes Movies XXX Mature Moms and Sexy MILFs Porno Clips,Adult
Pulitzer Prize and Emmy Award Winner Correspondent Host of Into America podcast Proud Milton Hershey School alum trymaine lee com,Non_Adult
Tucson s Best Newspaper,Non_Adult
Young pussies pics tight teen butts small pussy tiny tits black and asian and other porn niches,Adult
Chief News Correspondent for The Nine reporting from around the globe Formerly based in Los Angeles covering North America for BBC News,Non_Adult
Print Digital mag since 2002 The premiere magazine for meditation music arts wellness Ayurveda food film spirituality activism,Non_Adult
Breaking news and top stories from the NBC29 Newsroom a regional Edward R Murrow award winner in multimedia,Non_Adult
Fresh free porn movies free porn by category hardcore cumshot blowjob anal group sex mature bbw and big tits interracial lesbian shemale,Adult
Official home of the mighty Penrith Panthers on Twitter Follow for breaking news behind the scenes content exclusive offers and giveaways pantherpride,Non_Adult
Your breaking news now,Non_Adult
Clear conception innovation and design at the intersection of fashion and architecture United Nude products are architectural designswith a unique DNA Innovation in construction and materialization,Non_Adult
Get this domain name before someone else does Quick and painless shopping Affordable payment options available,Non_Adult
The Premier Publishing Resource for IndieAuthors Writers and Publishers,Non_Adult
The best HD gay porn videos updated with the hottest men and gay sex scenes Gay Room is the leader in exclusive hardcore gay porn movies,Adult
Chief investigative correspondent Yahoo News co author Russian Roulette host of award winning Co host misikoff com,Non_Adult
Looking for specific body types specific stars specific sexual acts or any other specific porn preferences Our clip search tool will find it for you,Adult
Get ready for your best orgasms free XXX video will give you crazy pleasure,Adult
Subscribe We are a newspaper serving the greater Lehigh Valley in eastern Pennsylvania including Allentown Bethlehem and Easton,Non_Adult
Owner and proprietor of Note This is a one way account in which I broadcast tweets but do not look at or respond to replies,Non_Adult
Founded by Nathaniel Fleischer in 1922 THE RING magazine is the oldest U S based boxing publication,Non_Adult
All things Crypto and NFT Posting the Latest News in the world of Crypto Currencies Crypto NFTs Gutter Cat Gang Cool Cats Bitcoin Ethereum Ripple,Non_Adult
Journalist Former War Correspondent Author Mideast Iran Afghanistan Ellis Island Medal of Honor Alum,Non_Adult
All the videos are on RealityKings com Check out the best porn videos in HD More than 13 THOUSAND full length videos are waiting for you,Adult
Your editorially independent source for Harvard news arts culture and more Sign up for our weekly newsletter,Non_Adult
Let s make Dallas even better,Non_Adult
Watch free real sexy amateur porn videos and clips on kodiefiles nl uploaded dump porn xxx real amateurs making horny pussy teen slut fuck hot,Adult
XXXYVideos brings you only the best xxx videos available on the net with daily updates Make sure you bookmark xxxyvideos com and come back tomorrow for more xxx videos,Adult
The weekly magazine for smart successful sophisticated women Follow us on Instagram too,Non_Adult
Columnist editor for Sun papers Postmedia afurey com Host of Postmedia podcast Full Comment with Anthony Furey,Non_Adult
Tired of jerkin off to old videos SheGotAss has lots of free black amateur ebony girl videos for your viewing pleasures In Ultra HD It makes your balls sour,Adult
Porn tube huge archives of porn categories and sex videos movies tube clips,Adult
Senior Correspondent and Bureau Chief ARD German TV London Foreign Correspondent with ARD since 2000 Warsaw New York London Views my own,Non_Adult
Thank you for choosing xxxorientalvideos com this is your new 1 Source for all things asian porno we have jav videos starring seductive japanese schoolgirls we have busty Chinese sluts thai t girls Vietnamese milfs and so much more our varied selection of hardcore pornography is sure to satisfy every possible taste be sure to check out our daily updates,Adult
Fresh and best porn videos Daily update XXX videos Fly with us on XXX Rocket,Adult
Join now and watch over 4500 mature porn scenes on Mature nl now We have the largest collection of mature porn videos featuring the best MILFs grannies gangbangs and the biggest tits so get your daily fill of mature sex right here,Adult
Las Vegas Magazine is the entertainment magazine of choice for Vegas visitors,Non_Adult
UNC s independent student newspaper Sign up for our daily newsletter Tips questions DM us Donate to the DTH,Non_Adult
Editorially independent student newspaper founded 1908 Sports sports Lifestyle arts,Non_Adult
The Indian blue movies are popular everywhere and you will hardly find the web service that would have no Indian sex video thrillers,Adult
1 Sunday Times Bestseller of Good Vibes Good Life Healing is the New High Inspiring GREATNESS KINDNESS EVOLUTION IG,Non_Adult
Chief Meteorologist managing editor of the climate unit at ABC News NotAWeatherGirl author Natural Disaster Chasing Helicity host Hearts of Heroes,Non_Adult
Largest retail fetish store in the USA A real brick and mortar store in business since 1995 one of largest focused retail fetish stores in the world,Non_Adult
Breaking news smart analysis and in depth features on global markets and finance from The Wall Street Journal,Non_Adult
REALTOR Magazine is the official publication of the National Association of REALTORS Our goal is simple Help real estate professionals succeed in business,Non_Adult
PornXab is Number one porn tube site in Internet Daily updated with 1000 s of porn videos We work really hard to bring You only specially selected High Quality Stream XXX Videos so You can relax and Enjoy watching it You will be able to watch all types of porn movies on our website different niches that will definately cover your dreams,Adult
MetaPorn is your ultimate source for the best free videos from all porn tubes on the internet One site to show them all Just click and wank,Adult
Watch more than 5 million Porn Videos on xHamster for free Stream new XXX tube movies online browse sex photos date girls to fuck at xHamster,Adult
Columnist Russian Media Analyst member,Non_Adult
Writer broadcaster for The SEC Network Columnist for Contributor to 680 The Fan,Non_Adult
Blacks On Blondes is the largest hardcore interracial porn site for movies and pictures blacksonblondes is also home of the Dogfart Movie Archive,Adult
See beautiful hairy girls with natural hairy pussy right here at WeAreHairy com Get 4 exclusive updates every single day from the premier hairy porn site online,Adult
Watch over 12 million of the best porn tube movies for FREE Sex videos updated every 5 minutes,Adult
We come from the future By,Non_Adult
IT consultant technology user tinkerer and sometimes Klingon tips pitch com,Non_Adult
Hawaii Food Tours,Non_Adult
is now follow us here for Vancouver s 1 breaking news traffic and weather,Non_Adult
We are the independent student newspaper at Indiana University Have news or questions Send us a DM For more Sports and BlackVoices,Non_Adult
Feel free to see the most goatish MILFs,Adult
3X Intl Bestseller KETO CLARITY COMPLETE GUIDE TO FASTING Podcastersince 2006 Host LLVLC REAL TALK Co host One Step Deeper,Non_Adult
Come and visit the sexiest livesex cam models on the net Horny girls boys and trannies are waiting for you Chat with them for free,Adult
The daily online magazine of Jewish news ideas and culture Subscribe to our newsletter and The Scroll,Non_Adult
Lex and Terry are a nationally syndicated radio show Telling dick jokes for a living,Adult
Live updates and breaking news as it happens from the journalists at,Non_Adult
Free To Join Browse Our Interracial Dating Community Meet 1000 s of Singles Online Today Using Our Secure Fun Interracial Dating Platform Join Today,Adult
Welcome to PornWorld com Home of World Class Hardcore Porn We have thousands of Full HD and 4K Porn Clips for Your Pleasure Enter And Enjoy,Adult
She Her Author of 1 bestseller Orange is the New Black My Year in a Women s Prison IG,Non_Adult
Congressional Correspondent with Grew up everywhere IN PA MN ND MT OR I promise I am better at instagram,Non_Adult
Your Favorite Free Porn Tube Don t miss daily updates,Adult
Bondage Fetish forum Discussions Personals Picturess and movies male female domination CatFight videos Smoking Fetish,Adult
Watch porn videos featuring the hottest pornstars on ZeroToleranceFilms com the world s best porn site,Adult
WARNING Are you 18 or older Welcome to Adult Talent Managers Founded in 2006 ATMLA has grown to become one of the largest and leading Adult Talent Agencies in the Los Angeles Area In 2012 ATMLA was sold and purchased by industry veteran Mark Schechter best known for his role as a partner in the award winning affiliate program Blazingbucks With over 20 years of experience in the adult industry Mark maintains an impressive reputation and track record of Read More,Adult
The official source of news for Pokmon Trainers in the UK and Ireland For customer service visit,Non_Adult
Latest cybersecurity news managed by Do not report hacking or other cyber incidents here Submit info at,Non_Adult
Breaking news since 1847,Non_Adult
Free MILF porn galleries with cheating wives and slut moms fucked raw Tons of categorized hot MILF porn pics including nude mom photos,Adult
Porn videos Mom Stepmom Lesbian Japanese Vintage Wife Mature Teen Interracial Homemade Erotic Massage Granny Hairy Caught and much more,Adult
Inspiring connecting UK tech businesses with breaking news data led industry analysis profiles events Founder 05,Non_Adult
Crazy Shit Making Memes Extreme Crazy Videos Video Clips Funny Videos Crazy Clips and More,Adult
Sunday NY Times Bestseller Chartered Council Psychologist Chartered Fellow Fellow S P H NHS EverydayJedi,Non_Adult
Free porn Big Ass Anal Ebony Bbw Interracial Shemale Latina Mom Stepmom Milf Bbc Chubby African Mature Ass Licking and much more,Adult
Millions of Free Tube Porn Videos Fresh Delicious like our Green Cucumber Doesn t matter you like it long thin or short fat You ll enjoy our Xxx Movies TubeCucumber,Adult
Host of The Forum Celeb Podcast I ve been featured on ESPN CBS ABC radio podcasts other media outlets JAMPA Media Network,Non_Adult
Free porn tube from youporn Sex Plux is the huge tube sex and hard movies download porn videos and free sex movies,Adult
Official Account of Sudarshan 24x7 National News by Show BindasBol Support,Non_Adult
Watch Mature xxx sex movies gets Crazy Granny xxx videos and Laid video on this tube porn site the ultimate archive of free mature and MILF hardcore porn tube,Adult
Some people do drugs I watch Republic Executive Editor at Watcher of nuisance on TV News Writer Anchor of TV Newsance,Non_Adult
Japanese Escort Girls Club All gentlemen of ladies first sipirit please enjoy full joy blissful moment to be served by ladies in this japan,Adult
Award winning broadcaster Author BecomingIman SermonsOfSoul iman com for bookings,Non_Adult
Gay Shop weltweit online,Adult
Multiple Award winning radio Tv broadcaster DJ Producer and Musician,Non_Adult
First for news sport weather in Queensland with Weekdays at 4pm nightly at 6pm Got a story Email 7NEWS com au 7NEWS,Non_Adult
Presenter producer BBC World News Focus On Africa What you need is near you I learn everyday Retweets replies not endorsements,Non_Adult
Shegods Shemale Movie Porn Post,Adult
The original blogger RT community Follow mention us for a RT bloggers lbloggers fbloggers bbloggers Founded by,Non_Adult
Radio and TV Producer and Broadcaster passionate about using media as a tool to cause positive change in the Society Road Safety Advocate and Idealist,Non_Adult
Author of NeuroTribes The Legacy of Autism and the Future of Neurodiversity a NYT bestseller The Taste of Salt a history of cystic fibrosis coming 2023,Non_Adult
purveyors of the world s finest junk NYT bestseller JG book catch us on hgtv digital this is tha scoop straight from jolie,Non_Adult
Visit Phazeddl for free reviews on Atlanta businesses and professionals Phazeddl is a great tool for finding top rated professionals near Atlanta,Non_Adult
Anthro journalist and author of Veneer of Civilisation Psychopathic Cultures and Beyond the End,Non_Adult
Philosopher energy expert Author NYT bestseller Moral Case for Fossil Fuels and Fossil Future Penguin 4 19 22 Founder Center for Industrial Progress,Non_Adult
Download porn online asian xxx online tube xxx online free free sex online mobile 3gp porn online japan free online download porn xxx asian porn sex,Adult
Digital News Service of Indias Public Broadcaster Breaking Alerts Digests curated Developing Stories from across the Globe Also on,Non_Adult
Breaking news and daily headlines from the nation s leading LGBTQ news source,Non_Adult
Enjoy free webcams broadcasted live from amateurs around the world Join 100 Free,Adult
CamGirlz Online Live Webcam Sex Shows For Free Without Registration Join largest Adult Sex Cams community and chat with 400 Online Webcam Models Now For FREE,Adult
Justice Correspondent Alignment Neutral Good Str 12 Dex 8 Con 15 Int 13 Wis 10 Char 14 Class Paladin Strong Against Republicans,Non_Adult
Hardcore porno tube brimming with asian hotties these seductive sluts love showing off their lithe bodies stripping masturbating sucking cocks getting fucked etc no matter if the girl is from japan china or vietnam you can always expect the amateurs and the pornstars featured here to give it their 110 enjoy your stay embrace this kinky culture,Adult
The Best XXX Tubes and XXX Tube Videos HDXXXL com This Tube Updates Hour amp amp Ranks All Porn Videos According Popularity Cum and Enjoy,Adult
The bi annual magazine for the culturally and visually hungry Preorder the Taking Back Control Issue now,Non_Adult
Welcome to PornWorld com Home of World Class Hardcore Porn We have thousands of Full HD and 4K Porn Clips for Your Pleasure Enter And Enjoy,Adult
The hottest blog on the Internet sex celebrities amateurs funny and shocking videos porn videos sexy pictures and much more,Adult
A fun app to collect and watch gorgeous girls getting naughty,Adult
Categorized Amateurs Teens Mature Anal Lesbians Pornstars Fetish Bbc Rough Hardcore etc Community Individual Accounts Private Albums Followers Likes Sharing Search Notofications etc Security Fully Encrypted And Trusted SSL Connection Legal Content Full Privacy,Adult
100 Free Gay Tube with gay porn movies big dick clips user uploaded porn videos and photos Updated daily,Adult
Racing Correspondent Broadcaster Journalist Speaker Writer BBC Sport 1990 2020 Ambassador Ambassador bid,Non_Adult
BreakingNews in Orlando and all of Central Florida Also at and Send breaking news tips N13 Desk com,Non_Adult
Perverted Hardcore Sex you can find here The most perverted hardcore videos only young and beautiful slaves are roughly fucked in the ass and they do a perfect wet rimjob male asshole licking,Adult
Young porn teens is a wild and passionate place where you can see smashing young sex movies which will dazzle your mind Check out this teen porn tube now,Adult
Daily Twitch Broadcaster Fitness Enthusiast Business inquiries faux gg,Non_Adult
CNN Senior Justice Correspondent covering law enforcement cyber national security,Non_Adult
Mens Luxury Lifestyle Aspirational and Inspirational,Non_Adult
Latinax Teen solo models petite girls ftv babes Latin X Girls,Adult
Tired of paying extra fees for everything than can be obtained free especially if these are the porn movies and sex videos Welcome to page that offers all the best and most popular porn videos which are Only Xhamster Tube collection,Adult
MilfSexMatureMom com Porn movies Mom Mature big tits Kitchen Old lady Hairy granny Granny big tits Massage Hairy redhead Hairy asian Japanese Mature bbw Black old and young Latina Mature amateur Hairy bbw Lady Spanish Hairy Mature anal Japanese mature Mature lesbian Hairy ass Hidden cam Monster cock Mature Latex Hardcore Mature fetish Japanese big tits Group Interracial Lesbian bbw Hairy mature Maid Mature and teen Mature asian Lingerie Housewife Handjob Fat orgy,Adult
Free Teen Porn Galleries Find The Hottest Teen Sex Pics Here,Adult
For latest news from Telangana and Hyderabad in real time Telangana s True Newspaper,Non_Adult
Experience the best porn and get in touch with some of the best models check out this top rated XXX tube a high rated website where you can delight with tons of quality videos pure XXX for free all with a simple click,Adult
Breaking Stories and information from WWL TV Channel 4 Eyewitness News CBS affiliate in New Orleans,Non_Adult
Subscribe at Power People Politics punchbowlnews,Non_Adult
Welcome to ClicPorn the porn tube site for the best porn videos in 2022 Enjoy movies channels pornstars hot photos live cams and gay porn in HD and homemade XXX ClicPorn com is 100 FREE,Adult
Vatican News is a service provided by the Holy See s Dicastery for Communication Follow us for news about Pope Francis the Vatican and the Church,Non_Adult
Licensed by the National Media Council SMS BARQE to 1110 at 4AED week and keep posted with the latest breaking news For more info please call 6005434443,Non_Adult
Farm Zoo Sex free porn site about zoophilia sex at farm Fun villagers with animals zoo sex last glade of peasant woman treason at farm best sex in life,Adult
Free porn and sex videos available absolutely free on Arion Movies com Enter the xxx world of unlimited homemade fuck videos and you are sure to stay with us for hours,Adult
Sports columnist emeritus for the Boston Globe,Non_Adult
columnist former co host of Love Stories Author of Sunday Times best sellers EVERYTHING I KNOW ABOUT LOVE 2018 GHOSTS 2020,Non_Adult
Free Porno Pics Free Sex Pics Porno Pictures and Movies galleries with daily updates,Adult
Community news for PokemonGO worldwide Not affiliated with Nintendo The Pokmon Company or Niantic Labs TheGameAwards,Non_Adult
best friends wives fuck hot tube porn videos my sex movies free housewives slut cheating cuckold husband nextdoor ex wife nasty busty housewife girlfriends homemade real house readers lonely old black dick white cock naked slutty nude mature fucking naughty uk amateur british viewers fun caught wild horny lovers swapping married watching older boobs big natural pussy sharing wife,Adult
Daily update 720p 1080p Full HD Porn Videos Discover the latest hd porn videos on the internet,Adult
Free and hardcore Indian porn featuring some of the most beautiful hindi hoes out there everybody knows that theres no one hotter than say a Desi mommy you are going to love watching Indian teens and milfs get fucked on camera its extremely arousing because its extremely taboo watch countless new Indian porn Videos without having to pay for them,Adult
Get all the major news that matters to you from San Diego s leading news source ABC 10News Got a news tip Call 619 237 6383 visit,Non_Adult
Unique project since 2011 The private life of other people live 24 7,Adult
Free sex German Mom Arabian Mature Stepmom Old Man Pregnant Hairy Japanese Turkish Secretary Lingerie Granny Cream Pie Teen and much more,Adult
Observer columnist Features Editor The Fence One time drinks dispenser to Mary McAleese Did Ye Hear Mammy Died OUT NOW at,Non_Adult
Pro gamer and game designer turned broadcaster Business bmk com Powered by Code BMK,Non_Adult
BDSM list an adult listing of bdsm and fetish adult oriented sites,Adult
Award winning lifestyle publication covering food philanthropy art entertainment style and all things Orlando since 1946 31 000 copies distributed monthly,Non_Adult
The trusted guide to gay porn offers daily galleries honest and up to date gay porn site reviews and a gay news blog,Adult
Girl from the north side former Dragon nurse business woman publisher broadcaster mother of one amazing boy,Non_Adult
Free sexy babes pictures galleries update daily,Adult
Guys With iPhones Powered by a love for hot men who appreciate the finer gadgets in life,Adult
Award winning gay adult studio based in Barcelona Join us to get access to our exclusive videos,Adult
Storyteller I like writing dark fiction because it allows me to put characters into extreme situations and then find out what they re made of LGBTQ,Adult
NBA correspondent NOW via Once Always Proudest Dad EVER,Non_Adult
Through fact based unbiased reporting we expose systemic wrongs counter misinformation and spark change See also,Non_Adult
